[
  {
    "id": "then-now-philippopolis-street-1878",
    "place_id": "place-old-town",
    "historical_archive_item_id": "archive-photo-philippopolis-street-1878",
    "title_bg": "Улица във Филипопол през януари 1878 г. — тогава/сега",
    "title_en": "Street in Philippopolis, January 1878 — then/now",
    "caption_bg": "Сравнение между архивния кадър „Улица във Филипопол през януари 1878 г.“ и съвременен свободно лицензиран образ на Старият град (Старинен Пловдив).",
    "caption_en": "Comparison between the archive image “Street in Philippopolis, January 1878” and a modern open-licensed image of The Old Town (Old Plovdiv).",
    "then_media": {
      "type": "image",
      "title": "0530 Вид на одну из улиц Филиппополя (Пловдива), январь 1878.jpg",
      "url": "https://upload.wikimedia.org/wikipedia/commons/b/b3/0530_%D0%92%D0%B8%D0%B4_%D0%BD%D0%B0_%D0%BE%D0%B4%D0%BD%D1%83_%D0%B8%D0%B7_%D1%83%D0%BB%D0%B8%D1%86_%D0%A4%D0%B8%D0%BB%D0%B8%D0%BF%D0%BF%D0%BE%D0%BF%D0%BE%D0%BB%D1%8F_%28%D0%9F%D0%BB%D0%BE%D0%B2%D0%B4%D0%B8%D0%B2%D0%B0%29%2C_%D1%8F%D0%BD%D0%B2%D0%B0%D1%80%D1%8C_1878.jpg",
      "page_url": "https://commons.wikimedia.org/wiki/File:0530_%D0%92%D0%B8%D0%B4_%D0%BD%D0%B0_%D0%BE%D0%B4%D0%BD%D1%83_%D0%B8%D0%B7_%D1%83%D0%BB%D0%B8%D1%86_%D0%A4%D0%B8%D0%BB%D0%B8%D0%BF%D0%BF%D0%BE%D0%BF%D0%BE%D0%BB%D1%8F_(%D0%9F%D0%BB%D0%BE%D0%B2%D0%B4%D0%B8%D0%B2%D0%B0)%2C_%D1%8F%D0%BD%D0%B2%D0%B0%D1%80%D1%8C_1878.jpg",
      "credit": "Unknown author",
      "license": "Public domain",
      "license_url": "https://commons.wikimedia.org/wiki/Commons:Licensing",
      "accessed_at": "2026-06-19",
      "source_id": "source-0530-vid-na-odnu-iz-ulits-filippopolya-plovdiva-yanvar-1878-jpg"
    },
    "now_media": {
      "type": "image",
      "title": "Renovated house in plovdiv old town.jpg",
      "url": "https://upload.wikimedia.org/wikipedia/commons/b/bb/Renovated_house_in_plovdiv_old_town.jpg",
      "page_url": "https://commons.wikimedia.org/wiki/File:Renovated_house_in_plovdiv_old_town.jpg",
      "credit": "Faces&&Places",
      "license": "CC BY 2.0",
      "license_url": "https://creativecommons.org/licenses/by/2.0",
      "accessed_at": "2026-06-19",
      "source_id": "source-wikimedia-commons-renovated-house-in-plovdiv-old-town-jpg"
    },
    "match_quality": "same_place_approximate_viewpoint",
    "data_quality": "public_source",
    "editorial": {
      "status": "needs_editorial_signoff",
      "reviewed_by": null,
      "reviewed_at": null,
      "notes_bg": "Тази двойка от историческо изображение и референтна снимка е автоматично подготвена и е показана като временна справка; независима редакторска проверка на визуалното съответствие, информацията за лиценза и авторството и контекста все още предстои.",
      "notes_en": "This pairing of a historical image and a reference photo was automatically prepared and is shown as a provisional reference; independent editorial review of the visual match, licence and attribution information, and context is still pending."
    },
    "source_ids": [
      "source-0530-vid-na-odnu-iz-ulits-filippopolya-plovdiva-yanvar-1878-jpg",
      "source-wikimedia-commons-renovated-house-in-plovdiv-old-town-jpg"
    ],
    "provenance": [
      {
        "source_id": "source-0530-vid-na-odnu-iz-ulits-filippopolya-plovdiva-yanvar-1878-jpg",
        "evidence_type": "then_now_historical_media",
        "claim_bg": "Архивен образ, лиценз и източникова страница за двойката \"Улица във Филипопол през януари 1878 г. — тогава/сега\".",
        "claim_en": "Historical image, license and source page for then/now pair \"Street in Philippopolis, January 1878 — then/now\".",
        "url": "https://commons.wikimedia.org/wiki/File:0530_%D0%92%D0%B8%D0%B4_%D0%BD%D0%B0_%D0%BE%D0%B4%D0%BD%D1%83_%D0%B8%D0%B7_%D1%83%D0%BB%D0%B8%D1%86_%D0%A4%D0%B8%D0%BB%D0%B8%D0%BF%D0%BF%D0%BE%D0%BF%D0%BE%D0%BB%D1%8F_(%D0%9F%D0%BB%D0%BE%D0%B2%D0%B4%D0%B8%D0%B2%D0%B0)%2C_%D1%8F%D0%BD%D0%B2%D0%B0%D1%80%D1%8C_1878.jpg",
        "accessed_at": "2026-06-19",
        "license_status": "open_license"
      },
      {
        "source_id": "source-wikimedia-commons-renovated-house-in-plovdiv-old-town-jpg",
        "evidence_type": "then_now_current_media",
        "claim_bg": "Съвременен образ, лиценз и източникова страница за двойката \"Улица във Филипопол през януари 1878 г. — тогава/сега\".",
        "claim_en": "Current comparison image, license and source page for then/now pair \"Street in Philippopolis, January 1878 — then/now\".",
        "url": "https://commons.wikimedia.org/wiki/File:Renovated_house_in_plovdiv_old_town.jpg",
        "accessed_at": "2026-06-19",
        "license_status": "open_license"
      }
    ]
  },
  {
    "id": "then-now-plovdiv-station-around-1880",
    "place_id": "place-plovdiv-central-railway-station-q7205164",
    "historical_archive_item_id": "archive-photo-plovdiv-station-around-1880",
    "title_bg": "Железопътната гара на Пловдив около 1880 г. — тогава/сега",
    "title_en": "Plovdiv railway station around 1880 — then/now",
    "caption_bg": "Сравнение между архивния кадър „Железопътната гара на Пловдив около 1880 г.“ и съвременен свободно лицензиран образ на Централна гара Пловдив.",
    "caption_en": "Comparison between the archive image “Plovdiv railway station around 1880” and a modern open-licensed image of Plovdiv Central railway station.",
    "then_media": {
      "type": "image",
      "title": "Plovdiv Train Station Around 1880.jpg",
      "url": "https://upload.wikimedia.org/wikipedia/commons/6/61/Plovdiv_Train_Station_Around_1880.jpg",
      "page_url": "https://commons.wikimedia.org/wiki/File:Plovdiv_Train_Station_Around_1880.jpg",
      "credit": "Dimitar Kavra",
      "license": "Public domain",
      "license_url": "https://commons.wikimedia.org/wiki/Commons:Licensing",
      "accessed_at": "2026-06-19",
      "source_id": "source-plovdiv-train-station-around-1880-jpg"
    },
    "now_media": {
      "type": "image",
      "title": "Plovdiv train station 2021 from train window.jpg",
      "url": "https://upload.wikimedia.org/wikipedia/commons/f/f4/Plovdiv_train_station_2021_from_train_window.jpg",
      "page_url": "https://commons.wikimedia.org/wiki/File:Plovdiv_train_station_2021_from_train_window.jpg",
      "credit": "Sharon Hahn Darlin",
      "license": "CC BY 2.0",
      "license_url": "https://creativecommons.org/licenses/by/2.0/",
      "accessed_at": "2026-07-09",
      "source_id": "source-plovdiv-train-station-2021-from-train-window-jpg"
    },
    "match_quality": "same_place_approximate_viewpoint",
    "data_quality": "public_source",
    "editorial": {
      "status": "needs_editorial_signoff",
      "reviewed_by": null,
      "reviewed_at": null,
      "notes_bg": "Тази двойка от историческо изображение и референтна снимка е автоматично подготвена и е показана като временна справка; независима редакторска проверка на визуалното съответствие, информацията за лиценза и авторството и контекста все още предстои.",
      "notes_en": "This pairing of a historical image and a reference photo was automatically prepared and is shown as a provisional reference; independent editorial review of the visual match, licence and attribution information, and context is still pending."
    },
    "source_ids": [
      "source-plovdiv-train-station-around-1880-jpg",
      "source-plovdiv-train-station-2021-from-train-window-jpg"
    ],
    "provenance": [
      {
        "source_id": "source-plovdiv-train-station-around-1880-jpg",
        "evidence_type": "then_now_historical_media",
        "claim_bg": "Архивен образ, лиценз и източникова страница за двойката \"Железопътната гара на Пловдив около 1880 г. — тогава/сега\".",
        "claim_en": "Historical image, license and source page for then/now pair \"Plovdiv railway station around 1880 — then/now\".",
        "url": "https://commons.wikimedia.org/wiki/File:Plovdiv_Train_Station_Around_1880.jpg",
        "accessed_at": "2026-06-19",
        "license_status": "open_license"
      },
      {
        "source_id": "source-plovdiv-train-station-2021-from-train-window-jpg",
        "evidence_type": "then_now_current_media",
        "claim_bg": "Съвременен образ, лиценз и източникова страница за двойката \"Железопътната гара на Пловдив около 1880 г. — тогава/сега\".",
        "claim_en": "Current comparison image, license and source page for then/now pair \"Plovdiv railway station around 1880 — then/now\".",
        "url": "https://commons.wikimedia.org/wiki/File:Plovdiv_train_station_2021_from_train_window.jpg",
        "accessed_at": "2026-07-09",
        "license_status": "open_license"
      }
    ]
  },
  {
    "id": "then-now-bahnhof-von-plowdiw",
    "place_id": "place-plovdiv-central-railway-station-q7205164",
    "historical_archive_item_id": "archive-postcard-bahnhof-von-plowdiw",
    "title_bg": "Пощенска картичка „Bahnhof von Plowdiw“ — тогава/сега",
    "title_en": "Postcard: Bahnhof von Plowdiw — then/now",
    "caption_bg": "Сравнение между архивния кадър „Пощенска картичка „Bahnhof von Plowdiw““ и съвременен свободно лицензиран образ на Централна гара Пловдив.",
    "caption_en": "Comparison between the archive image “Postcard: Bahnhof von Plowdiw” and a modern open-licensed image of Plovdiv Central railway station.",
    "then_media": {
      "type": "image",
      "title": "Bahnhof von Plowdiw.jpg",
      "url": "https://upload.wikimedia.org/wikipedia/commons/4/43/Bahnhof_von_Plowdiw.jpg",
      "page_url": "https://commons.wikimedia.org/wiki/File:Bahnhof_von_Plowdiw.jpg",
      "credit": "Unknown author",
      "license": "Public domain",
      "license_url": "https://commons.wikimedia.org/wiki/Commons:Licensing",
      "accessed_at": "2026-06-19",
      "source_id": "source-bahnhof-von-plowdiw-jpg"
    },
    "now_media": {
      "type": "image",
      "title": "Plovdiv train station 2021 from train window.jpg",